{
  "version": "0.1.0",
  "last_updated": "2026-08-04",
  "note": "Initial master architecture. Chapter titles are not permanently fixed. Stable chapter_id values survive reordering.",
  "identity_ref": "data/project/book_identity.json",
  "front_matter": [
    "CC-CH-001",
    "CC-CH-002",
    "CC-CH-003",
    "CC-CH-004",
    "CC-CH-005",
    "CC-CH-006",
    "CC-CH-007"
  ],
  "parts": [
    {
      "part_id": "CC-PART-01",
      "number": 1,
      "title": "Why We Need Something New",
      "dir": "part-01",
      "chapter_ids": [
        "CC-CH-008",
        "CC-CH-009",
        "CC-CH-010",
        "CC-CH-011",
        "CC-CH-012",
        "CC-CH-013",
        "CC-CH-014"
      ]
    },
    {
      "part_id": "CC-PART-02",
      "number": 2,
      "title": "First Principles",
      "dir": "part-02",
      "chapter_ids": [
        "CC-CH-015",
        "CC-CH-016",
        "CC-CH-017",
        "CC-CH-018",
        "CC-CH-019",
        "CC-CH-020",
        "CC-CH-021",
        "CC-CH-022",
        "CC-CH-023",
        "CC-CH-024",
        "CC-CH-025"
      ]
    },
    {
      "part_id": "CC-PART-03",
      "number": 3,
      "title": "The Economic Constitution",
      "dir": "part-03",
      "chapter_ids": [
        "CC-CH-026",
        "CC-CH-027",
        "CC-CH-028",
        "CC-CH-029",
        "CC-CH-030",
        "CC-CH-031",
        "CC-CH-032",
        "CC-CH-033",
        "CC-CH-034",
        "CC-CH-035",
        "CC-CH-036",
        "CC-CH-037",
        "CC-CH-038"
      ]
    },
    {
      "part_id": "CC-PART-04",
      "number": 4,
      "title": "Rebuilding the System",
      "dir": "part-04",
      "chapter_ids": [
        "CC-CH-039",
        "CC-CH-040",
        "CC-CH-041",
        "CC-CH-042",
        "CC-CH-043",
        "CC-CH-044",
        "CC-CH-045",
        "CC-CH-046",
        "CC-CH-047",
        "CC-CH-048",
        "CC-CH-049",
        "CC-CH-050",
        "CC-CH-051",
        "CC-CH-052",
        "CC-CH-053",
        "CC-CH-054",
        "CC-CH-055",
        "CC-CH-056",
        "CC-CH-057",
        "CC-CH-058",
        "CC-CH-059",
        "CC-CH-060",
        "CC-CH-061",
        "CC-CH-062",
        "CC-CH-063",
        "CC-CH-064",
        "CC-CH-065"
      ]
    },
    {
      "part_id": "CC-PART-05",
      "number": 5,
      "title": "Protecting the Republic",
      "dir": "part-05",
      "chapter_ids": [
        "CC-CH-066",
        "CC-CH-067",
        "CC-CH-068",
        "CC-CH-069",
        "CC-CH-070",
        "CC-CH-071",
        "CC-CH-072"
      ]
    },
    {
      "part_id": "CC-PART-06",
      "number": 6,
      "title": "The Transition",
      "dir": "part-06",
      "chapter_ids": [
        "CC-CH-073",
        "CC-CH-074",
        "CC-CH-075",
        "CC-CH-076",
        "CC-CH-077",
        "CC-CH-078",
        "CC-CH-079",
        "CC-CH-080",
        "CC-CH-081",
        "CC-CH-082",
        "CC-CH-083"
      ]
    },
    {
      "part_id": "CC-PART-07",
      "number": 7,
      "title": "The Future",
      "dir": "part-07",
      "chapter_ids": [
        "CC-CH-084",
        "CC-CH-085",
        "CC-CH-086",
        "CC-CH-087",
        "CC-CH-088",
        "CC-CH-089",
        "CC-CH-090"
      ]
    }
  ],
  "closing": {
    "part_id": "CC-PART-CLOSE",
    "title": "Closing Materials",
    "chapter_ids": [
      "CC-CH-091",
      "CC-CH-092",
      "CC-CH-093",
      "CC-CH-094",
      "CC-CH-095",
      "CC-CH-096",
      "CC-CH-097",
      "CC-CH-098"
    ]
  },
  "chapters": [
    {
      "chapter_id": "CC-CH-001",
      "title": "Title Page",
      "part_id": null,
      "part_title": "Front Matter",
      "section": "front-matter",
      "chapter_number": null,
      "order": 1,
      "status": "concept",
      "public_status": "hidden",
      "summary": "",
      "central_question": "",
      "core_claims": [],
      "research_requirements": [],
      "source_ids": [],
      "word_count_target": 1200,
      "current_word_count": 0,
      "review_status": "unreviewed",
      "research_readiness": 0,
      "editorial_readiness": 0,
      "file": "content/manuscript/front-matter/01-title-page.md",
      "last_updated": "2026-08-04"
    },
    {
      "chapter_id": "CC-CH-002",
      "title": "Dedication",
      "part_id": null,
      "part_title": "Front Matter",
      "section": "front-matter",
      "chapter_number": null,
      "order": 2,
      "status": "concept",
      "public_status": "hidden",
      "summary": "",
      "central_question": "",
      "core_claims": [],
      "research_requirements": [],
      "source_ids": [],
      "word_count_target": 1200,
      "current_word_count": 0,
      "review_status": "unreviewed",
      "research_readiness": 0,
      "editorial_readiness": 0,
      "file": "content/manuscript/front-matter/02-dedication.md",
      "last_updated": "2026-08-04"
    },
    {
      "chapter_id": "CC-CH-003",
      "title": "A Note to the Reader",
      "part_id": null,
      "part_title": "Front Matter",
      "section": "front-matter",
      "chapter_number": null,
      "order": 3,
      "status": "concept",
      "public_status": "hidden",
      "summary": "",
      "central_question": "",
      "core_claims": [],
      "research_requirements": [],
      "source_ids": [],
      "word_count_target": 1200,
      "current_word_count": 0,
      "review_status": "unreviewed",
      "research_readiness": 0,
      "editorial_readiness": 0,
      "file": "content/manuscript/front-matter/03-a-note-to-the-reader.md",
      "last_updated": "2026-08-04"
    },
    {
      "chapter_id": "CC-CH-004",
      "title": "Preface: Why This Book Is Being Given Away",
      "part_id": null,
      "part_title": "Front Matter",
      "section": "front-matter",
      "chapter_number": null,
      "order": 4,
      "status": "concept",
      "public_status": "hidden",
      "summary": "",
      "central_question": "",
      "core_claims": [],
      "research_requirements": [],
      "source_ids": [],
      "word_count_target": 1200,
      "current_word_count": 0,
      "review_status": "unreviewed",
      "research_readiness": 0,
      "editorial_readiness": 0,
      "file": "content/manuscript/front-matter/04-preface-why-this-book-is-being-given-away.md",
      "last_updated": "2026-08-04"
    },
    {
      "chapter_id": "CC-CH-005",
      "title": "The Definition of Constitutional Capitalism",
      "part_id": null,
      "part_title": "Front Matter",
      "section": "front-matter",
      "chapter_number": null,
      "order": 5,
      "status": "concept",
      "public_status": "hidden",
      "summary": "",
      "central_question": "",
      "core_claims": [],
      "research_requirements": [],
      "source_ids": [],
      "word_count_target": 1200,
      "current_word_count": 0,
      "review_status": "unreviewed",
      "research_readiness": 0,
      "editorial_readiness": 0,
      "file": "content/manuscript/front-matter/05-the-definition-of-constitutional-capitalism.md",
      "last_updated": "2026-08-04"
    },
    {
      "chapter_id": "CC-CH-006",
      "title": "The Central Proposition",
      "part_id": null,
      "part_title": "Front Matter",
      "section": "front-matter",
      "chapter_number": null,
      "order": 6,
      "status": "concept",
      "public_status": "hidden",
      "summary": "",
      "central_question": "",
      "core_claims": [],
      "research_requirements": [],
      "source_ids": [],
      "word_count_target": 1200,
      "current_word_count": 0,
      "review_status": "unreviewed",
      "research_readiness": 0,
      "editorial_readiness": 0,
      "file": "content/manuscript/front-matter/06-the-central-proposition.md",
      "last_updated": "2026-08-04"
    },
    {
      "chapter_id": "CC-CH-007",
      "title": "How to Read This Book",
      "part_id": null,
      "part_title": "Front Matter",
      "section": "front-matter",
      "chapter_number": null,
      "order": 7,
      "status": "concept",
      "public_status": "hidden",
      "summary": "",
      "central_question": "",
      "core_claims": [],
      "research_requirements": [],
      "source_ids": [],
      "word_count_target": 1200,
      "current_word_count": 0,
      "review_status": "unreviewed",
      "research_readiness": 0,
      "editorial_readiness": 0,
      "file": "content/manuscript/front-matter/07-how-to-read-this-book.md",
      "last_updated": "2026-08-04"
    },
    {
      "chapter_id": "CC-CH-008",
      "title": "The Promise of Free Enterprise",
      "part_id": "CC-PART-01",
      "part_title": "Why We Need Something New",
      "section": "part-01",
      "chapter_number": 1,
      "order": 1,
      "status": "concept",
      "public_status": "hidden",
      "summary": "",
      "central_question": "",
      "core_claims": [],
      "research_requirements": [],
      "source_ids": [],
      "word_count_target": 2500,
      "current_word_count": 0,
      "review_status": "unreviewed",
      "research_readiness": 0,
      "editorial_readiness": 0,
      "file": "content/manuscript/part-01/01-the-promise-of-free-enterprise.md",
      "last_updated": "2026-08-04"
    },
    {
      "chapter_id": "CC-CH-009",
      "title": "When Success Creates New Problems",
      "part_id": "CC-PART-01",
      "part_title": "Why We Need Something New",
      "section": "part-01",
      "chapter_number": 2,
      "order": 2,
      "status": "concept",
      "public_status": "hidden",
      "summary": "",
      "central_question": "",
      "core_claims": [],
      "research_requirements": [],
      "source_ids": [],
      "word_count_target": 2500,
      "current_word_count": 0,
      "review_status": "unreviewed",
      "research_readiness": 0,
      "editorial_readiness": 0,
      "file": "content/manuscript/part-01/02-when-success-creates-new-problems.md",
      "last_updated": "2026-08-04"
    },
    {
      "chapter_id": "CC-CH-010",
      "title": "The Great Economic Disconnect",
      "part_id": "CC-PART-01",